Id,DisplayedName,Description,Index3,Icon_DDSFile,ActiveSkillTargetTypes,ActiveSkillTypeKeys,WeaponRestriction_ItemClassesKeys,WebsiteDescription,WebsiteImage,Flag0,Unknown0,Flag1,SkillTotemId,IsManuallyCasted,Input_StatKeys,Output_StatKeys,MinionActiveSkillTypes,Flag2,Flag3,Keys0,Unknown1,Key0,Flag4,AIFile,Keys1,Flag5,Flag6,Flag7
sweep,Arrastão,"Balança uma arma de duas mãos em um círculo, empurrando alguns monstros em volta do personagem.",Sweep,Art/2DArt/SkillIcons/sweep.dds,"[1, 2]","[<0, 0>, <7, 0>, <23, 0>, <19, 0>, <27, 0>]","[<14, 0>, <16, 0>, <17, 0>, <15, 0>, <57, 0>]","Sometimes a good blade just isn't enough. With a mighty swing, a player wielding a staff, two-handed axe or mace smashes the skulls of many enemies surrounding them. The furious blow breaks armour and bone alike, even knocking foes back a substantial distance.",http://s3.amazonaws.com/pathofexile/image/skills/strength/sweep.jpg,False,Sweep,False,21,True,"[<4029, 0>, <4279, 0>, <4192, 0>, <10542, 0>]","[<24, 0>, <479, 0>, <434, 0>, <185, 0>]",[],True,True,[],8,"<null, null>",False,,"[<2, 0>, <18, 0>, <10, 0>, <11, 0>, <29, 0>, <16, 0>, <17, 0>, <19, 0>, <26, 0>, <14, 0>, <15, 0>, <28, 0>, <35, 0>]",False,False,1
vaal_sweep,Arrastão Vaal,"Balança uma arma de duas mãos repetidamente em um círculo, empurrando monstros para longe do personagem.",Sweep,Art/2DArt/SkillIcons/sweep.dds,"[1, 2]","[<0, 0>, <7, 0>, <19, 0>, <37, 0>, <27, 0>]","[<14, 0>, <16, 0>, <17, 0>, <15, 0>, <57, 0>]",,,True,,False,21,True,"[<4029, 0>, <4279, 0>, <4192, 0>, <10542, 0>]","[<24, 0>, <479, 0>, <434, 0>, <185, 0>]",[],True,True,[],8,"<null, null>",False,,"[<2, 0>, <18, 0>, <10, 0>, <11, 0>, <29, 0>, <16, 0>, <17, 0>, <19, 0>, <26, 0>, <14, 0>, <15, 0>, <28, 0>, <35, 0>]",False,False,1
ground_slam,Impacto Sísmico,"O personagem bate no chão à sua frente com um Cajado ou Maça ou Cetro, criando uma onda que segue para frente e causa dano a inimigos, com mais chances de atordoar.",GroundSlam,Art/2DArt/SkillIcons/icongroundslam.dds,"[1, 2]","[<0, 0>, <7, 0>, <23, 0>, <19, 0>, <91, 0>, <14, 0>]","[<12, 0>, <32, 0>, <14, 0>, <17, 0>, <36, 0>, <57, 0>]","Raising a staff or two handed mace high above their head, the player slams it earthward with a crackling thud. The force of this blow sunders soil and rock, forking outward to stun and damage enemies that stand ahead. At greater levels of skill, the fissures from Ground Slam travel a long distance, causing tremendous harm to anything caught in their path.",http://s3.amazonaws.com/pathofexile/image/skills/strength/ground_slam.jpg,False,GroundSlam,False,21,True,"[<3993, 0>, <4179, 0>, <5496, 0>]","[<24, 0>, <434, 0>, <8059, 0>]",[],True,True,[],8,"<null, null>",False,,"[<2, 0>, <18, 0>, <10, 0>, <11, 0>, <29, 0>, <16, 0>, <17, 0>, <19, 0>, <26, 0>, <14, 0>, <15, 0>, <28, 0>, <35, 0>]",False,False,1
vaal_ground_slam,Impacto Sísmico Vaal,"O personagem bate no chão à sua frente com um Cajado ou Maça ou Cetro, criando uma onda que viaja para todas as direções.",VaalGroundSlam,Art/2DArt/SkillIcons/icongroundslam.dds,"[1, 2]","[<0, 0>, <7, 0>, <19, 0>, <37, 0>, <91, 0>, <14, 0>]","[<12, 0>, <32, 0>, <14, 0>, <17, 0>, <36, 0>, <57, 0>]",,,True,,False,21,True,"[<3993, 0>, <4179, 0>, <5496, 0>]","[<24, 0>, <434, 0>, <8059, 0>]",[],True,True,[],8,"<null, null>",False,,"[<2, 0>, <18, 0>, <10, 0>, <11, 0>, <29, 0>, <16, 0>, <17, 0>, <19, 0>, <26, 0>, <14, 0>, <15, 0>, <28, 0>, <35, 0>]",False,False,1
distance_scaled_ground_slam,Impacto Sísmico,"O personagem bate no chão à sua frente com um Cajado, Machado ou Maça ou Cetro, criando uma onda que segue para frente e causa dano a inimigos, com mais chances de atordoar. A onda causa mais dano a curta distância.",DistanceScaledGroundSlam,Art/2DArt/SkillIcons/icongroundslam.dds,"[1, 2]","[<0, 0>, <7, 0>, <23, 0>, <19, 0>, <91, 0>, <14, 0>]","[<12, 0>, <32, 0>, <14, 0>, <17, 0>, <11, 0>, <16, 0>, <36, 0>, <57, 0>]","Raising a staff or two handed mace high above their head, the player slams it earthward with a crackling thud. The force of this blow sunders soil and rock, forking outward to stun and damage enemies that stand ahead. At greater levels of skill, the fissures from Ground Slam travel a long distance, causing tremendous harm to anything caught in their path.",http://s3.amazonaws.com/pathofexile/image/skills/strength/ground_slam.jpg,True,DistanceScaledGroundSlam,False,21,True,"[<3993, 0>, <4179, 0>, <5496, 0>]","[<24, 0>, <434, 0>, <8059, 0>]",[],True,True,"[<3439, 0>]",8,"<null, null>",False,,"[<2, 0>, <18, 0>, <10, 0>, <11, 0>, <29, 0>, <16, 0>, <17, 0>, <19, 0>, <26, 0>, <14, 0>, <15, 0>, <28, 0>, <35, 0>]",False,False,1
vaal_ground_slam_spiked,Impacto Sísmico Vaal,"O personagem bate no chão à sua frente com um Cajado, Machado ou Maça ou Cetro, criando uma onda que viaja para todas as direções, causando dano e atordoando aos inimigos. A onda causa mais dano a curta distância.",VaalDistanceScaledGroundSlam,Art/2DArt/SkillIcons/icongroundslam.dds,"[1, 2]","[<0, 0>, <7, 0>, <19, 0>, <37, 0>, <91, 0>, <14, 0>]","[<12, 0>, <32, 0>, <14, 0>, <17, 0>, <11, 0>, <16, 0>, <36, 0>, <57, 0>]",,,True,VaalDistanceScaledGroundSlam,False,21,True,"[<3993, 0>, <4179, 0>, <5496, 0>]","[<24, 0>, <434, 0>, <8059, 0>]",[],True,True,[],8,"<null, null>",False,,"[<2, 0>, <18, 0>, <10, 0>, <11, 0>, <29, 0>, <16, 0>, <17, 0>, <19, 0>, <26, 0>, <14, 0>, <15, 0>, <28, 0>, <35, 0>]",False,False,1
cleave,Cutilada,"O personagem balança sua arma (ou ambas as armas se estiver com dupla empunhadura) em um arco, causando dano em uma área na sua frente. Funciona apenas com Machados e Espadas.",Cleave,Art/2DArt/SkillIcons/iconcleave.dds,"[1, 2]","[<0, 0>, <7, 0>, <23, 0>, <19, 0>, <43, 0>, <27, 0>]","[<9, 0>, <10, 0>, <11, 0>, <15, 0>, <16, 0>]","Wielders of the axe and sword often find themselves beset by multiple foes. Expecting this, a trained armsman will employ the deadly Cleave. With a single practiced stroke, a Cleave sweeps sideways to inflict grievous harm to anyone standing nearby, lopping off heads and limbs with ease. As a player gains skill with Cleave, they strike harder with each swing of their blade.",http://s3.amazonaws.com/pathofexile/image/skills/strength/cleave.jpg,False,Cleave,False,21,True,"[<3986, 0>, <4208, 0>, <4178, 0>, <5383, 0>]","[<24, 0>, <70, 0>, <434, 0>, <5420, 0>]",[],True,True,"[<5385, 0>]",8,"<null, null>",False,,"[<2, 0>, <18, 0>, <10, 0>, <11, 0>, <29, 0>, <16, 0>, <17, 0>, <19, 0>, <26, 0>, <14, 0>, <15, 0>, <28, 0>, <35, 0>]",False,False,1
shield_charge,Investida com Escudo,"Faz uma investida contra um inimigo, batendo nele com o escudo do personagem golpeando-o. Inimigos no caminho são empurrados para o lado. Dano e atordoamento são proporcionais à distância viajada. Não pode ser suportado por Multi-ataque.",ShieldCharge,Art/2DArt/SkillIcons/iconshieldcharge.dds,"[1, 2]","[<0, 0>, <19, 0>, <20, 0>, <33, 0>, <78, 0>]","[<6, 0>, <7, 0>, <9, 0>, <10, 0>, <11, 0>, <12, 0>, <32, 0>, <36, 0>, <56, 0>]","In the hands of a talented combatant, even a shield becomes a deadly weapon. With Shield Charge, a warrior dashes forward at a single enemy, slamming them senseless. The violence of the charge will push nearby foes out of its path, and inflict great damage on target. An opponent unlucky enough to be struck by the full brunt of a Shield Charge will be knocked back and stunned for a time.",http://s3.amazonaws.com/pathofexile/image/skills/strength/shield_charge.jpg,True,ShieldCharge,False,21,True,"[<4215, 0>, <4015, 0>]","[<70, 0>, <24, 0>]",[],True,True,[],8,"<0, 0>",False,,"[<2, 0>, <18, 0>, <10, 0>, <11, 0>, <29, 0>, <16, 0>, <17, 0>, <19, 0>, <26, 0>, <14, 0>, <15, 0>, <28, 0>, <35, 0>, <37, 0>]",False,False,1
new_shield_charge,Investida com Escudo,"Faz uma investida em direção a um local ou inimigo, empurrando inimigos no caminho e causando dano repetidamente em uma pequena área na sua frente. Quanto mais você viajar, mais dano causará e maiores serão as chances de atordoar os inimigos. Não pode ser suportado por Multi-ataque.",NewShieldCharge,Art/2DArt/SkillIcons/iconshieldcharge.dds,"[1, 2, 23]","[<0, 0>, <9, 0>, <19, 0>, <7, 0>, <33, 0>, <78, 0>]","[<6, 0>, <7, 0>, <9, 0>, <10, 0>, <11, 0>, <12, 0>, <32, 0>, <36, 0>, <56, 0>]","In the hands of a talented combatant, even a shield becomes a deadly weapon. With Shield Charge, a warrior dashes forward at a single enemy, slamming them senseless. The violence of the charge will push nearby foes out of its path, and inflict great damage on target. An opponent unlucky enough to be struck by the full brunt of a Shield Charge will be knocked back and stunned for a time.",http://s3.amazonaws.com/pathofexile/image/skills/strength/shield_charge.jpg,False,NewShieldCharge,False,21,True,"[<4215, 0>, <4015, 0>]","[<70, 0>, <24, 0>]",[],True,True,[],8,"<0, 0>",False,,"[<2, 0>, <18, 0>, <10, 0>, <11, 0>, <29, 0>, <16, 0>, <17, 0>, <19, 0>, <26, 0>, <14, 0>, <15, 0>, <28, 0>, <35, 0>, <37, 0>]",False,False,1
new_new_shield_charge,Investida com Escudo,"Faz uma investida em direção a um local ou inimigo, empurrando inimigos no caminho e causando dano repetidamente da mão secundária em uma pequena área na sua frente. Você causa dano em uma grande área ao atingir seu alvo. Quanto mais você viajar, mais dano causará e maiores serão as chances de atordoar os inimigos. Não pode ser suportado por Multi-ataque.",NewNewShieldCharge,Art/2DArt/SkillIcons/iconshieldcharge.dds,"[1, 2, 23]","[<0, 0>, <9, 0>, <19, 0>, <7, 0>, <33, 0>, <78, 0>, <27, 0>]","[<26, 0>]","In the hands of a talented combatant, even a shield becomes a deadly weapon. With Shield Charge, a warrior dashes forward at a single enemy, slamming them senseless. The violence of the charge will push nearby foes out of its path, and inflict great damage on target. An opponent unlucky enough to be struck by the full brunt of a Shield Charge will be knocked back and stunned for a time.",http://s3.amazonaws.com/pathofexile/image/skills/strength/shield_charge.jpg,False,NewShieldCharge,False,21,True,"[<4215, 0>, <4015, 0>]","[<70, 0>, <24, 0>]",[],True,True,[],8,"<0, 0>",False,,"[<2, 0>, <18, 0>, <10, 0>, <11, 0>, <29, 0>, <16, 0>, <17, 0>, <19, 0>, <26, 0>, <14, 0>, <15, 0>, <28, 0>, <35, 0>]",False,False,1
enduring_cry,Clamor Tolerante,"Executa um clamor, provocando todos os inimigos ao redor à atacar o usuário e concedendo cargas de tolerância. Dá um breve aumento de regeneração de vida, assim como um buff que concede resistências e redução de dano físico baseado nas suas cargas de tolerância.",EnduringCry,Art/2DArt/SkillIcons/WarCryEnduring.dds,[4],"[<4, 0>, <7, 0>, <8, 0>, <62, 0>, <89, 0>]",[],"In battle, it's often someone's job to stand in the front line, and take most of the punishment. Few relish this task, but those who do know the secret of the Enduring Cry. This battle shout taunts all nearby enemies, compelling them to attack the offender, while simultaneously boosting his ability to absorb punishment in direct proportion to the number of nearby foes.",http://s3.amazonaws.com/pathofexile/image/skills/strength/enduring_cry.jpg,False,EnduringCry,False,21,True,"[<9668, 0>, <5520, 0>, <4509, 0>, <4372, 0>]","[<9667, 0>, <4535, 0>, <4535, 0>, <3339, 0>]",[],True,True,"[<12328, 0>]",8,"<null, null>",False,,[],False,False,1
enduring_cry_repeatable,,,EnduringCry,,[4],"[<4, 0>, <7, 0>, <8, 0>, <21, 0>, <62, 0>]",[],,,True,,False,21,True,[],[],[],True,True,[],8,"<null, null>",False,,[],False,False,1
inspiring_cry,Clamor Inspirador,"Executa um clamor, concedendo dano e regeneração de mana adicionais para você e seus aliados. O dano é aumentado conforme o número de inimigos próximos. Provoca todos os inimigos próximos para atacar o usuário. Compartilha o tempo de recarga com outras habilidades de Clamores.",InspiringCry,Art/2DArt/SkillIcons/InspiringCry.dds,[4],"[<4, 0>, <7, 0>, <8, 0>, <62, 0>, <89, 0>]",[],,,True,RallyingCry,False,21,True,"[<9668, 0>, <5520, 0>, <4511, 0>, <4353, 0>]","[<9667, 0>, <4535, 0>, <4535, 0>, <215, 0>]",[],True,True,[],8,"<null, null>",False,,[],False,False,1
abyssal_cry,Clamor Abissal,"Executa um clamor, Desacelerando inimigos próximos e fazendo com que explodam ao serem mortos. O efeito de desaceleração é aumentado conforme o número de inimigos próximos. Provoca todos os inimigos próximos para atacar o usuário. Compartilha o tempo de recarga com outras habilidades de Clamores.",AbyssalCry,Art/2DArt/SkillIcons/AbyssalCry.dds,[4],"[<7, 0>, <8, 0>, <41, 0>, <6, 0>, <62, 0>, <89, 0>]",[],,,True,AbyssalCry,False,21,True,"[<9668, 0>, <4070, 0>, <4354, 0>]","[<9667, 0>, <24, 0>, <215, 0>]",[],True,True,[],8,"<null, null>",False,,"[<4, 0>, <18, 0>, <10, 0>, <11, 0>, <29, 0>, <16, 0>, <17, 0>, <19, 0>, <26, 0>]",False,False,1
leap_slam,Salto Impactante,"Salta no ar, causando dano e empurrando inimigos com sua arma ao pousar. Inimigos em que você pousar em cima são empurrados para fora do caminho. Requer um Machado, Maça, Cetro, Espada ou Cajado. Não pode ser suportado por Multi-ataque.",LeapSlam,Art/2DArt/SkillIcons/iconleapslam.dds,"[1, 2]","[<0, 0>, <7, 0>, <19, 0>, <33, 0>, <78, 0>, <91, 0>, <14, 0>]","[<9, 0>, <10, 0>, <11, 0>, <12, 0>, <32, 0>, <14, 0>, <15, 0>, <16, 0>, <17, 0>, <57, 0>]","Long ago, the marauders of Oriath perfected a devastating battle technique - the ferocious Leap Slam. With a guttural cry, the leaper hurtles forward and smashes the ground at the feet of the enemy. The force from this blow deals substantial damage in a circle around the targeted spot, and will even knock back and stun. The Leap Slam is useful not only as an offensive technique, but also because it can serve, in a pinch, to escape from danger. The Marauders of Oriath were famous for attacking their foes from above, leaping down from high ledges to crush their enemies' skulls.",http://s3.amazonaws.com/pathofexile/image/skills/strength/leap_slam.jpg,False,LeapSlam,False,21,True,"[<4214, 0>, <4011, 0>, <4187, 0>]","[<70, 0>, <24, 0>, <434, 0>]",[],True,True,[],8,"<6, 0>",False,,"[<2, 0>, <18, 0>, <10, 0>, <11, 0>, <29, 0>, <16, 0>, <17, 0>, <19, 0>, <26, 0>, <14, 0>, <15, 0>, <28, 0>, <35, 0>]",False,False,1
leap_slam_behind,Salto Impactante,,LeapSlam,Art/2DArt/SkillIcons/iconleapslam.dds,[9],"[<0, 0>, <7, 0>, <19, 0>, <33, 0>, <78, 0>, <91, 0>, <14, 0>]","[<9, 0>, <10, 0>, <11, 0>, <12, 0>, <32, 0>, <14, 0>, <15, 0>, <16, 0>, <17, 0>, <57, 0>]",,,True,,False,21,True,[],[],[],True,True,[],8,"<0, 0>",False,,"[<2, 0>, <18, 0>, <10, 0>, <11, 0>, <29, 0>, <16, 0>, <17, 0>, <19, 0>, <26, 0>, <14, 0>, <15, 0>, <28, 0>, <35, 0>]",False,False,1
double_strike,Golpe Duplo,Executa dois ataques rápidos com uma arma corpo a corpo.,DoubleStrike,Art/2DArt/SkillIcons/icondoubleswing.dds,"[1, 2]","[<0, 0>, <20, 0>, <23, 0>, <19, 0>, <27, 0>]","[<6, 0>, <7, 0>, <9, 0>, <10, 0>, <11, 0>, <12, 0>, <32, 0>, <14, 0>, <15, 0>, <16, 0>, <17, 0>, <57, 0>, <56, 0>]","Originally perfected by the renowned Duelist Fammal during his reign in the arenas of Oriath, the deadly Double Strike brings fame and renown to those who master it. A Double Strike performs two regular melee attacks in the blink of an eye, dealing twice as much damage in a single span of time. Foes caught unawares will find themselves cut to ribbons or stunned into submission beneath a flurry of blows.",http://s3.amazonaws.com/pathofexile/image/skills/dexterity/double_strike.jpg,False,DoubleStrike,False,21,True,"[<3987, 0>, <4209, 0>, <4245, 0>, <7960, 0>]","[<24, 0>, <70, 0>, <554, 0>, <7961, 0>]",[],True,True,[],8,"<null, null>",False,,"[<2, 0>, <18, 0>, <10, 0>, <11, 0>, <29, 0>, <16, 0>, <17, 0>, <19, 0>, <26, 0>, <14, 0>, <15, 0>, <28, 0>, <35, 0>]",False,False,1
vaal_double_strike_two,Golpe Duplo Vaal,"Executa dois ataques rápidos com uma arma corpo a corpo, cada um deles convoca um clone seu por um período para continuamente atacar monstros desta forma.",VaalDoubleStrikeTwo,Art/2DArt/SkillIcons/icondoubleswing.dds,"[1, 2]","[<0, 0>, <20, 0>, <19, 0>, <8, 0>, <37, 0>, <27, 0>]","[<6, 0>, <7, 0>, <9, 0>, <10, 0>, <11, 0>, <12, 0>, <32, 0>, <14, 0>, <15, 0>, <16, 0>, <17, 0>, <57, 0>, <56, 0>]",,,True,VaalDoubleStrikeTwo,False,21,True,"[<3987, 0>, <4209, 0>, <4245, 0>, <7960, 0>]","[<24, 0>, <70, 0>, <554, 0>, <7961, 0>]",[],True,True,[],8,"<null, null>",False,,"[<2, 0>, <18, 0>, <10, 0>, <11, 0>, <29, 0>, <16, 0>, <17, 0>, <19, 0>, <26, 0>, <14, 0>, <15, 0>, <28, 0>, <35, 0>]",False,False,1
vaal_double_strike,Golpe Duplo Vaal,Executa dois ataques rápidos com uma arma corpo a corpo e convoca um clone seu por um período para atacar monstros continuamente desta forma.,VaalDoubleStrike,Art/2DArt/SkillIcons/icondoubleswing.dds,"[1, 2]","[<0, 0>, <20, 0>, <19, 0>, <8, 0>, <37, 0>, <27, 0>]","[<6, 0>, <7, 0>, <9, 0>, <10, 0>, <11, 0>, <12, 0>, <32, 0>, <14, 0>, <15, 0>, <16, 0>, <17, 0>, <57, 0>, <56, 0>]",,,True,,False,21,True,"[<3987, 0>, <4209, 0>, <4245, 0>, <7960, 0>]","[<24, 0>, <70, 0>, <554, 0>, <7961, 0>]",[],True,True,[],8,"<null, null>",False,,"[<2, 0>, <18, 0>, <10, 0>, <11, 0>, <29, 0>, <16, 0>, <17, 0>, <19, 0>, <26, 0>, <14, 0>, <15, 0>, <28, 0>, <35, 0>]",False,False,1
elemental_hit,Acerto Elemental,"Cada ataque com essa habilidade escolherá um elemento aleatório, e apenas poderá causar dano daquele elemento. Se o ataque acertar um inimigo, ele também causará dano em área ao redor dele, com o raio sendo maior caso o inimigo esteja sofrendo de uma afecção do elemento escolhido. Ela evitará escolher o mesmo elemento duas vezes seguidas.",ElementalHit,Art/2DArt/SkillIcons/iconelementalhit.dds,"[1, 2]","[<0, 0>, <2, 0>, <56, 0>, <14, 0>, <13, 0>, <15, 0>, <20, 0>, <23, 0>, <19, 0>, <28, 0>, <29, 0>, <30, 0>, <40, 0>, <57, 0>, <7, 0>, <31, 0>, <101, 0>]",[],"Cold steel tends to solve most problems, but sometimes it's not quite enough. With Elemental Hit, a player infuses their weapon with the heat of a furnace, the electricity of a Summer tempest, or the icy chill of the Winter night. The specific element is randomly chosen, but the result is the same: tons of extra damage dealt, often killing the target with a single blow.",http://s3.amazonaws.com/pathofexile/image/skills/dexterity/elemental_hit.jpg,False,ElementalHit,False,21,True,"[<4282, 0>, <4217, 0>, <4032, 0>]","[<1874, 0>, <70, 0>, <24, 0>]",[],True,True,[],8,"<3, 0>",False,,"[<2, 0>, <18, 0>, <10, 0>, <11, 0>, <29, 0>, <16, 0>, <17, 0>, <19, 0>, <26, 0>, <14, 0>, <15, 0>, <28, 0>, <35, 0>]",False,False,1
immortal_call,Chamado Imortal,"Consome Cargas de Tolerância, tornando o personagem invulnerável a dano físico por um curto período, proporcional a quantas cargas de tolerância foram gastas.",ImmortalCall,Art/2DArt/SkillIcons/immortalcall.dds,[4],"[<1, 0>, <4, 0>, <8, 0>, <14, 0>, <31, 0>, <27, 0>, <63, 0>, <89, 0>]",[],"Even with the added toughness granted from Endurance Charges, a combatant sometimes finds themselves facing impossible odds. This rare event makes flight a good option and sometimes it even merits the power of the Immortal Call. The legendary war cry channels all current Endurance into an invisible shield that shelters the player from all physical harm for a brief duration. Consuming more charges will extend the duration of the Immortal shield, giving plenty of time for escape or victory.",http://s3.amazonaws.com/pathofexile/image/skills/strength/immortal_call.jpg,False,ImmortalCall,False,21,True,"[<4335, 0>]","[<215, 0>]",[],True,True,[],8,"<null, null>",False,,[],False,False,1
mortal_call,Chamado Imortal,Sofre menos dano Físico e Elemental por um curto período de tempo. Consome até 5 Cargas de Tolerância para aumentar o efeito e receber ainda menos Dano Físico. Compartilha o tempo de recarga com outras habilidades de Guarda.,ImmortalCall,Art/2DArt/SkillIcons/immortalcall.dds,[4],"[<1, 0>, <4, 0>, <8, 0>, <14, 0>, <31, 0>, <63, 0>, <77, 0>, <89, 0>]",[],,,True,MortalCall,False,21,True,"[<4335, 0>, <9397, 0>, <9881, 0>]","[<215, 0>, <9398, 0>, <361, 0>]",[],True,True,[],8,"<null, null>",False,,[],False,False,1
vaal_immortal_call,Chamado Imortal Vaal,"Consome Cargas de Tolerância, tornando o personagem incapaz de morrer ou ganhar almas Vaal por um curto período, proporcional a quantas cargas de tolerância foram gastas.",ImmortalCall,Art/2DArt/SkillIcons/immortalcall.dds,[4],"[<1, 0>, <4, 0>, <8, 0>, <14, 0>, <37, 0>, <85, 0>, <89, 0>]",[],,,True,,False,21,True,"[<4335, 0>, <9881, 0>]","[<215, 0>, <360, 0>]",[],True,True,[],8,"<null, null>",False,,[],False,False,1
dual_strike,Ataque Combinado,"Ataca com ambas as armas, causando o dano de ambas em um ataque. Dupla empunhadura apenas. Não funciona com varinhas.",DualStrike,Art/2DArt/SkillIcons/icondualswing.dds,"[1, 2]","[<0, 0>, <3, 0>, <20, 0>, <23, 0>, <19, 0>, <43, 0>]","[<6, 0>, <7, 0>, <9, 0>, <10, 0>, <11, 0>, <12, 0>, <32, 0>, <16, 0>, <56, 0>]","Double Strike was not the only attack Fammal mastered during his years in the arenas. He also perfected the technique of the Dual Strike, and used it to decimate countless opponents. Those who follow in his footsteps seek to duplicate the art, and at high levels of skill, a few manage. Dual Strike lashes out at a single target with tremendous force, slicing or smashing it with both weapons simultaneously. When executed by a master swordsman, just one Dual Strike is often enough to end the battle.",http://s3.amazonaws.com/pathofexile/image/skills/dexterity/dual_strike.jpg,False,DualStrike,False,21,True,"[<3988, 0>, <4210, 0>, <4246, 0>, <5398, 0>, <11975, 0>, <11978, 0>, <11981, 0>, <11984, 0>, <11987, 0>]","[<24, 0>, <70, 0>, <554, 0>, <5427, 0>, <11976, 0>, <11979, 0>, <11982, 0>, <11985, 0>, <11988, 0>]",[],True,True,[],8,"<null, null>",False,,"[<2, 0>, <18, 0>, <10, 0>, <11, 0>, <29, 0>, <16, 0>, <17, 0>, <19, 0>, <26, 0>, <14, 0>, <15, 0>, <28, 0>, <35, 0>]",False,False,1
blade_flurry,Lâminas Giratórias,"Mergulha nos inimigos, causando dano da arma. Funciona apenas com adagas, garras e espadas de uma mão.  Não pode ser suportado por Multi-ataque.",BladeFlurry,Art/2DArt/SkillIcons/iconbladeflurry.dds,"[1, 2, 9, 23]","[<0, 0>, <19, 0>, <33, 0>, <78, 0>]","[<7, 0>, <9, 0>, <10, 0>, <6, 0>, <56, 0>]",,http://s3.amazonaws.com/pathofexile/image/skills/dexterity/blade_flurry.jpg,False,WhirlingBlades,False,21,True,"[<4395, 0>, <4057, 0>]","[<70, 0>, <24, 0>]",[],True,True,[],8,"<0, 0>",False,,"[<2, 0>, <18, 0>, <10, 0>, <11, 0>, <29, 0>, <16, 0>, <17, 0>, <19, 0>, <26, 0>, <14, 0>, <15, 0>, <28, 0>, <35, 0>]",False,False,1
frenzy,Frenesi,Executa um ataque que dá uma carga de frenesi ao personagem se ele acertar. Cargas de frenesi aumentam sua velocidade de ataque.,Frenzy,Art/2DArt/SkillIcons/iconfrenzy.dds,"[1, 2]","[<0, 0>, <40, 0>, <57, 0>, <2, 0>, <56, 0>, <14, 0>, <13, 0>, <15, 0>, <20, 0>, <23, 0>, <19, 0>, <31, 0>]",[],"The bread and butter of any effective combat skill set, Frenzy is used by many and feared by all. With Frenzy active, every successful attack dealt accelerates the next attack, transforming the player into an offensive dervish. Once the Frenzy is at full intensity, it can be maintained indefinitely as long as the player strikes a new target in time. Several skills consume Frenzy charges when they are activated, enabling new ways to decimate foes.",http://s3.amazonaws.com/pathofexile/image/skills/dexterity/frenzy.jpg,False,Frenzy,False,21,True,"[<4030, 0>, <4280, 0>]","[<24, 0>, <1654, 0>]",[],True,True,[],8,"<3, 0>",False,,"[<2, 0>, <18, 0>, <10, 0>, <11, 0>, <29, 0>, <16, 0>, <17, 0>, <19, 0>, <26, 0>, <14, 0>, <15, 0>, <28, 0>, <35, 0>]",False,False,1
caustic_arrow,Flecha Cáustica,"Dispara uma flecha que causa dano de caos em área no impacto, e cria uma nuvem cáustica. Inimigos na área sofrem dano degenerativo de caos.",CausticArrow,Art/2DArt/SkillIcons/poisonarrow.dds,"[1, 2]","[<0, 0>, <40, 0>, <57, 0>, <2, 0>, <56, 0>, <7, 0>, <8, 0>, <13, 0>, <15, 0>, <14, 0>, <34, 0>, <41, 0>, <31, 0>]","[<13, 0>]","Borrowing a bit of toxic chemistry from the secretive Oriath Necromancers guild, a skilled archer infuses their arrowhead with a wicked venom. Once enchanted, the arrow will explode violently when it impacts a target, showering both foes and the surrounding area with a cloud of choking death. Anything living caught in the cloud will suffocate quickly, suffering heavy chaos damage until they move far away.",http://s3.amazonaws.com/pathofexile/image/skills/dexterity/poison_arrow.jpg,False,PoisonArrow,False,21,True,"[<4045, 0>, <4244, 0>, <4203, 0>, <8372, 0>, <8371, 0>, <8435, 0>, <8437, 0>, <8439, 0>]","[<24, 0>, <215, 0>, <434, 0>, <8336, 0>, <8370, 0>, <6106, 0>, <1975, 0>, <8440, 0>]",[],True,True,[],8,"<7, 0>",False,,"[<2, 0>, <18, 0>, <10, 0>, <11, 0>, <29, 0>, <16, 0>, <17, 0>, <19, 0>, <26, 0>, <14, 0>, <15, 0>, <28, 0>, <35, 0>]",False,False,1
backstab,Apunhalada Traiçoeira,Uma habilidade de adaga que causa um acerto crítico e dano adicional a um inimigo se o ataque é feito por trás do inimigo. Tem custo de mana e tempo de recarga altos.,Backstab,Art/2DArt/SkillIcons/backstab.dds,"[1, 2]","[<0, 0>, <20, 0>, <23, 0>, <19, 0>]","[<7, 0>, <56, 0>]",,,True,,False,21,True,[],[],[],True,True,[],8,"<null, null>",False,,"[<2, 0>, <18, 0>, <10, 0>, <11, 0>, <29, 0>, <16, 0>, <17, 0>, <19, 0>, <26, 0>, <14, 0>, <15, 0>, <28, 0>, <35, 0>]",False,False,1
